11-AP-2012,Full,"Demolition of existing building and erection of a building (with basement) up to eight storeys in height (maximum 28.50m at corner) fronting Marshalsea Road and Borough High Street comprising office / retail floorspace (Class B1 / Class A use) and 96 residential units; erection of a four storey mews building to the rear (13.10m) comprising 4 residential units; provision of open space with ancillary plant, car parking and servicing, works of hard and soft landscaping and new pedestrian access to Borough High Street together with other associated and enabling works",,"Brandon House, 180",Borough High Street,SE1 1LW,CATHEDRALS,13/09/2013,01/08/2018,97,20,
14-AP-2709,Full,"DEMOLITION OF EXISTING BUILDINGS (SUI GENERIS) AND REDEVELOPMENT TO PROVIDE A PART 3/4//5/7 STOREY DEVELOPMENT COMPRISING 55 FLATS (X9 ONE BED, X7 THREE BED) (USE CLASS C3), 305SQM RETAIL FLOOR SPACE (USE CLASS A1/A2/A3), ASSOCIATED DISABLED CAR PARKING AND AMENITY SPACE AND REPLACEMENT SUBSTATION",,2-16,Amelia Street,SE17 3PY,NEWINGTON,30/03/2015,01/08/2018,55,20,
03-AP-1848,Full,"Demol pre-fabs for 3-storey block of 6x flats;pt 3/4-sty terrace 5x 4-bed houses, 14x flats, 10 p.s.",,Land Bounded By,Underhill Road,SE22 0AW,EAST DULWICH,18/03/2005,31/07/2006,19,19,
04-AP-2114,Full,"Build 31 mixed tenure flats in 4/5/6 storey blocks, one multi use commercial unit in Block D, Blocks A to C all resid.",,14-26,Wansey Street,SE17,EAST WALWORTH,10/02/2005,31/10/2006,31,19,
12-AP-2702,Full,"Demolition of existing warehouse building and construction of buildings ranging in height from 4 storeys to 6 storeys, plus basement, to provide 82 residential units with landscaping, refuse/recycling facilities, cycle storage and car parking, access and associated works",,"Marshall House, 6",Pages Walk,SE1 4SB,GRANGE,11/12/2012,06/11/2017,86,19,
13-AP-3791,Full,"Demolition of 1, 3-5 Valentine Place and 27-31 Webber Street and part demolition of 7-19 Valentine Place and 21 Webber Street (facades retained). Redevelopment of the site to provide 62 residential units (max 7 storeys), 3854sqm Class B1 (business) and 138sqm A1/A3 (retail and food and drink) floorspace, together with landscaping and car parking.",,"1, 3-5, 7-19",Valentine Place,SE1 8QH,CATHEDRALS,25/09/2014,03/03/2017,61,19,"500,000"
15-AP-2217,Full,"DEMOLITION OF EXISTING BUILDING AND REDEVELOPMENT OF SITE TO PROVIDE A MIXED-USE BUILDING RANGING FROM 4 TO 7 STOREYS PLUS BASEMENT COMPRISING 94 RESIDENTIAL UNITS (USE CLASS C3) AND FLEXIBLE COMMERICIAL FLOORSPACE (USE CLASSES A1, A2, A3, A4, B1, D2) ASSOCIATED HIGHWAY, PUBLIC REALM AND LANDSCAPING WORKS, CAR AND CYCLE PARKING AND ASSOCIATED WORKS",,24-28,Quebec Way,SE16 7LF,SURREY DOCKS,04/03/2016,07/08/2018,94,19,
06-AP-0995,Full,Demolition of buildings at 1-15 Bournemouth Road and erection of 8 storey building comprising 54 flats together with refurbishment and alterations to 143-147 Rye Lane for 7 self contained flats on upper floors with roof terrace and continued use of ground floor for retail (RESUBMISSION),,1-15,Bournemouth Road,SE15 4ST,THE LANE,18/04/2007,21/08/2013,62,18,
08-AP-2440,Full,"Erection of one part 4, part 5 storey building on the corner of Brandon Street and Charleston Street and one part 5, part 6 storey building on the corner of Brandon Street and Larcom Street, comprising 18 dwellings in total with communal private courtyard and public amenity space at ground floor level.",,Land Adjoining,Brandon Street,SE17 1NL,EAST WALWORTH,12/01/2009,31/01/2012,18,18,
12-AP-3860,Full,"Demolition of existing community centre to provide new 7 storey building comprising 18 residential apartments (4 x 1 bed, 5 x 2 bed, 5 x 3 bed and 4 x 4 bed) (100% affordable), replacement community centre (326 sq m) with associated facilities and replacement estate office (108 sq m). Provision of 38 cycle parking spaces.",,Estate Office,Avondale Square,SE1 5PD,SOUTH BERMONDSEY,28/02/2013,09/09/2016,18,18,
05-AP-2441,Full,Erection of a three storey extension to the existing accommodation for elderly to provide  17 flats of housing for elderly people plus ancillary spaces.,,"Lime Tree House,  2",Dundas Street,SE15 2DL,NUNHEAD,10/02/2006,29/02/2008,17,17,
09-CO-0095,Full,"Conversion of 35 existing sheltered accommodation flats at ground floor level, and associated areas, into 17 general needs flats (8 x two bed, 8 x three bed,1 x four bed), and associated landscaping and disabled parking bays and elevational alterations, including works to the flats  to be insulated externally and over clad with brick slips and render, and three external stairs serving upper floors are to be removed and the three original internal stairwells are to be reinstated.",,"Fearnley House , Lettsom Estate",Vestry Road,SE5 8JW,BRUNSWICK PARK,21/01/2010,31/10/2011,17,17,0
05-AP-0078,Full,"Mixed use development for 4 storey building with nursery/children's centre on ground /1st floors, 16 key worker flats on part 1st to 3rd floors.",,South Bermondsey Children's Centre,Tenda Road,SE16 3PN,SOUTH BERMONDSEY,17/03/2005,01/11/2006,16,16,
05-AP-0566,Full,"Demolish council housing office + public house for part 3/4/5/6 storey building incluidng basement parking, A3/A4 class unit, 61 flats.",,"Final Furlong P.H., 161",Grange Road,SE1,GRANGE,22/12/2005,30/09/2008,61,16,
10-AP-1966,Full,"Demolition of vacant nursery and domestic garage structures. Erection of three storey and four storey building to provide 16 residential units comprising 6 No. three bedroom, 6 No. two bedroom and 4 No. one bedroom flats with associated amenity space. Erection of free standing plant and secure cycle storage enclosures.  Provision of public children's play area and replacement car parking spaces.",,"Lindley Estate, Garages And Nursery Site",Peckham Park Road,SE 6SX,LIVESEY,22/10/2010,19/08/2013,16,16,
10-AP-2183,Full,"Partial redevelopment and remodelling of the building fronting Sumner Road to provide 22 maisonettes (20 x three bedroom, 1 x four bedroom, 1 x five bedroom) within a four storey building (following fire damage to the property).",,25-46,Carisbrooke Gardens,SE15 6JR,PECKHAM,04/03/2011,01/05/2013,22,16,0
14-AP-4905,Full,"The erection of a part four, part five and part six storey building to provide 43 residential flats (8 x one-bed, 26_x005F_x000D_
x two-bed and 9 x three-bed), with associated car parking, cycle and refuse store and amenity space.",,525-539,Old Kent Road,SE1 5EW,SOUTH BERMONDSEY,30/03/2015,12/12/2016,43,16,
03-AP-0641,Full,"Demolition of existing building, construction of a 7 storey building comprising office use on ground floor, 83 self contained flats (9 social rented, 6 shared ownership; mainly 2 bedroom) on the upper floors together with associated car parking (40 spaces) and amenity space.",,193-197,Long Lane,SE1 4PN,GRANGE,25/01/2005,31/03/2007,83,15,
04-AP-0226,Full,Erect part 6/9 storey building + basement for 41 flats/ 21 underground parking spaces/ cycle storage (31m high).,,"Tavern Quay Car Park, Western Half",Rope Street,SE16,SURREY DOCKS,28/09/2005,06/02/2016,41,15,
04-AP-1645,Full,"Demolish, new 7 storey building for 41x 1-bed, 20x 2-bed, 6x 3-bed flats + 654 sq m offices, 35 basement p.s.",,52-56,Lant Street,SE1 1QP,CATHEDRALS,07/01/2005,25/10/2006,67,15,
06-AP-0901,Full,"Erection of 5 storey building fronting Dog Kennel Hill adjoining Walcot House, providing school accommodation on ground floor with residential accommodation consisting of 15 x 2 bed residential flats.",,"Dog Kennel Hill School,",Dog Kennel Hill,SE22 8AB,SOUTH CAMBERWELL,01/03/2007,02/03/2007,15,15,
06-AP-1217,Full,"The construction of part two, part four and part six storey building comprising facilities for Blackfriars Settlement on ground and first floors, including a creche, offices, workshops and the construction of 36 flats comprising  18, one bed, 15 two bed and 3, three bedroom flats.",,"Blackfriars Settlement,  1-5",Rushworth Street,SE1 0RB,CATHEDRALS,02/04/2008,07/09/2012,36,15,
08-AP-2409,Full,"Erection of five storey building plus basement comprising 15 residential units, 1 disabled parking space, 32 cycle parking spaces, plus refuse and recycling storage .",,Site Adjacent To 60,St George's Road,SE1 6ET,CATHEDRALS,06/01/2009,03/11/2010,15,15,
08-AP-2427,Full,"Erection of part three/four/five/six storey block comprising 34 residential flats with private terraces/balconies, communal courtyard and roof garden with pergola and cycle parking; erection of 6 three storey 4 bedroom townhouses with private gardens; community garden",,Site Adjoining,Library Street,SE1 0RN,CATHEDRALS,07/01/2009,05/01/2012,40,15,
13-AP-2902,Full,Demolition of existing garages and erection of x15 affordable and x10 private ownership dwellings over three and five storeys with landscaped courtyard,Masterman Housing,"Garages To The South Of Masterman House, Elimington Esate",Lomond Grove,SE5,CAMBERWELL GREEN,29/04/2014,09/09/2016,25,15,
03-AP-1979,Full,"Construct 14x self contained flats on site of public house, + car parking.",,"Belvedere P.H.,  43",Linden Grove,SE15 3LW,NUNHEAD,28/10/2004,01/12/2006,14,14,
05-AP-2109,Full,"Demolition of existing buildings and the erection of a new build 1 x 2 storey block (Unit C) comprising 1 x 3 bedroom flat and 1 x 2 bedroom flat, a 2 storey block comprising 4 x 2 bedroom duplex flats (Unit B) and a 3 storey building with recessed 4th floor comprising of 8 x 2 bedroom flats (Unit A) with associated secure off-street parking to be provided on the adjoining site",,Rear Of 159-161 + 163,Peckham Rye,SE15 3HX,PECKHAM RYE,01/11/2006,01/04/2011,14,14,
06-AP-0541,Full,"Construction of two residential blocks, 1 x three storey block fronting Peckham Hill Street and 1 x 3 storey block to rear of site creating total of 14 flats (2 x 1-bed , 9 x 2-bed, 3 x 3-bed), with assoc amenity space, 6 off-street car parking spaces, bicycle storage - RE-SUBMISSION",,32,Peckham Hill Street,SE15 6BN,LIVESEY,15/10/2007,16/02/2009,14,14,
06-AP-1376,Full,"Alterations to previous p.p. 04-AP-2348: 18 additional dwellings in building fronting Abbey St for total 3x studios, 35x 1-bed, 30x 2-bed, 8x 3-bed flats + balconies; also elevational changes to bldng on Tower Bridge Rrd + cycle store. Prev perm = Redevelopment of New Caledonian antiques market to provide three new buildings; two of which are positioned around a central public square: _x005F_x000D_
_x005F_x000D_
Building A (facing Tower Bridge Road and Abbey Street) - part six, part eight and part ten storey building  comprising a mix of retail (Class A1), offices (Class B1), arts/leisure, cafe/restaurant uses (Class A3) and 56 flats on upper floors;_x005F_x000D_
_x005F_x000D_
Building B (facing Bermondsey Street): seven storeys with market store and cafe/restaurant (Class A3) on ground and first floors with hotel on upper floors and roof top bar ; _x005F_x000D_
_x005F_x000D_
Building C (facing Long Walk): part three and part four storeys comprising 14 flats; and Provision of landscaped public square to accommodate 200 market stalls.",,"New Caledonian Market, Bermondsey Square",Tower Bridge Road,SE1,CHAUCER,28/06/2007,30/09/2011,90,14,"292,704"
09-AP-0604,Full,Erection of 5-storey building comprising 14 self-contained flats. Housing mix amended under approved application 12/AP/1548,,23,Rotherhithe Old Road,SE16 2PP,ROTHERHITHE,01/07/2010,03/03/2015,14,14,0
10-AP-0614,Full,"Development of fourteen flats over three storeys (2 x 1 bed, 10 x 2 bed, 2 x 3 bed) with associated hard and soft landscaping, parking and refuse facilities.",,8,Lynton Road,SE1 5QR,SOUTH BERMONDSEY,23/09/2010,31/03/2012,14,14,0
12-AP-3127,Full,"Demolition of the existing building and erection of a building of between 3 and 6 storeys in height to provide 51 residential units (16 x 1 bed, 25 x 2 bed and 10 x 3 bed) with ancillary car parking, cycle storage and landscaping. The proposal would retain the existing war memorial fronting Old Jamaica Road.",,2,Old Jamaica Road,SE16 4AN,RIVERSIDE,04/03/2013,03/03/2015,51,14,
13-AP-3815,Full,"REDEVELOPMENT OF 235-241 UNION ST (OCTAVIA HOUSE) INCLUDING GARAGES AND SUBSTATION TO THE REAR AND ADJOINING NETWORK RAIL LAND TO PROVIDE A 14 STOREY BUILDING (MAX HEIGHT 44.2M) FOR THE LONDON CENTRE FOR CONTEMPORARY MUSIC AT BASEMENT, GROUND, FIRST, SECOND, THIRD FOURTH FLOORS (USE CLASS D1) A GROUND FLOOR CAFE (CLASS A3) AND 55 RESIDENTIAL UNITS (CLASS C3) ACROSS THE 5TH TO 14TH FLOORS INCLUDING ASSOCIATED CYCLE PARKING, ONE ON-SITE CAR PARKING SPACE; REPROVISION OF 8 GARAGES AND LANDSCAPED PUBLIC REALM",,"Octiavia House, 235-241",Union St,SE1 0LR,CATHEDRALS,19/08/2014,01/01/2017,55,14,"1,100,000"
04-AP-0680,Full,Construction of a 3 storey building of 13 flats on vacant site.,,"Gloucester Grove Est, Between 15-17 & 39-41",Newent Close,SE15,BRUNSWICK PARK,01/12/2004,31/08/2008,13,13,
04-AP-1477,Outline,Redevelop College Annexe for residential use.,,"Camberwell Art College Annexe,  166",Sumner Road,SE15 6JL,PECKHAM,29/12/2005,31/03/2013,39,13,
08-AP-0749,Full,Erection of part 4/ 6/ 7 storey building of 13 flats plus ground floor A1/ A3 use; ancillary plant and cycle store.,,The Island Site,Long Walk,SE1 3UN,GRANGE,11/08/2008,12/08/2011,13,13,"493,938"
10-AP-3173,Full,Erection of a 3 storey block with roof terrace comprising a total of  13 residential units,,25 - 35,Chesterfield Way,SE15 2LL,NUNHEAD,22/03/2011,31/03/2013,13,13,
11-AP-1390,Full,"Demolition of the existing building and redevelopment of the site by the erection of a part 2, 3, 4 and 5 storey building (5 storeys fronting Grange Road) comprising 38 residential units (2 x studio, 11 x 1 bed, 17 x 2 bed and 8 x 3 bed); 4 car parking spaces and 46 secure cycle parking spaces within the rear courtyard and ancillary landscaping.",,177 -184,Grange Road,SE1 3AA,GRANGE,10/08/2011,19/06/2013,38,13,0
13-AP-4420,Full,"Construction of 13 residential units comprising 5 x 2 bed units within a new 6 storey building located between the Elliston and Wilkins buildings and 8 further residential units (4 x 1 bed, 2 x 2 bed and 2 x 3 bed) within a single storey extension creating a fifth floor across both Elliston and Wilkins buildings. Associated circulation space, bike store (providing 20 cycle spaces), bin store and 1 disabled parking space.",,George Elliston House,Old Kend Road,SE1 5ET,SOUTH BERMONDSEY,01/05/2014,09/08/2016,13,13,
04-AP-1685,Full,Construction of 3 storey building for 12x residential flats.,,"Ex Star Of India P.H.,  Junction Of",Brayards Road,SE15,THE LANE,06/01/2005,30/11/2008,12,12,
06-AP-2081,Full,"The erection of part seven/ eight storey building comprising two office (class B1) units on ground floor and 38 residential units (4, three bedroom, 15 two bedroom, and 19 one bedroom units) on the upper floors, together with three off street parking spaces, cycle storage and ancillary cycle parking",,Gedling Mission Hall,Sweeney Crescent,SE1 2DS,RIVERSIDE,24/08/2007,30/09/2009,38,12,
09-AP-1342,Full,"Erection of twelve houses including one bungalow (remainder two storey with pitched roofs), one on-site parking space.",,Site Adjacent To 19,Rosenthorpe Street,SE15 3EG,PECKHAM RYE,22/01/2009,30/06/2011,12,12,0
09-AP-2130,Full,"Construction of a three / four storey block consisting of twelve new dwellings (5 x 4 bedroom houses, 1 x 4 bedroom maisonette, 5 x 2 bedroom flats and 1 x 1 bedroom flat) with associated landscaping and cycle parking.",,Land Adjacent To 114,Woodland Road,SE19 1PA,COLLEGE,29/09/2009,31/01/2012,12,12,
13-AP-1738,Full,"Demolition of 2 A-C Carlton Grove. Erection of part 4 part 6 storey building, with a detached two/three storey building behind, providing 420sqm of ground floor retail space (Use Class A1) and 47 self contained dwellings. Provision of 5 accessible parking spaces off street, and associated communal amenity space.",,83-89,Queens Road,SE15 2EZ,LIVESEY,14/02/2014,08/08/2016,47,12,
09-AP-1940,Full,"Demolition of existing building and erection of a 22 storey mixed use building (max.building height 69.82m AOD) incorporating a 65sq.m cafe/kiosk (Use Class A3) over ground and mezzanine floors, 366sq.m of commercial floorspace (Use Class B1) from ground to second floor level, with 38 residential units above (10x 1 bed, 24x 2 bed and 4x 3 bed), 50 cycle spaces over ground/ mezzanine floors with 6 visitor cycle spaces external to the building, in addition to a basement area containing plant and an energy centre, and two wind turbines sited at rooftop level",,89 - 93,Newington Causeway,SE1 6BN,CHAUCER,16/11/2011,03/03/2015,38,11,0
11-AP-3251,Full,"Redevelopment of the site involving the erection of a 4 storey building to provide 41 residential units (19x1 bed, 13x2 bed and 9x3 bed) including 4 wheelchair accessible units, 2 off street disabled parking spaces, vehicular access from Crimscott Street, 57 cycle parking spaces and associated landscaping.",,34-42,Grange Road,SE1 3BE,GRANGE,22/12/2011,15/01/2014,41,11,
13-AP-0065,Full,"Demolition of existing building and the erection of a part 6, part 19 storey building (maximum height from ground 61.3m) with basement for a mixed use scheme comprising of 158 residential dwellings, primary school for Southwark Free School, sixth form and community centre for City of London Academy, with associated amenity and play space, basement car and cycle parking and landscaping.",,399,Rotherhithe New Road,SE16 3HG,LIVESEY,18/06/2014,20/07/2018,158,11,
06-AP-1293,Full,"The erection of a building on ground, first, second, third and fourth floors (five storeys) with part basement, comprising commercial units on part of the ground floor on Grange Road frontage (Classes A1, A2 or A3: retail, financial and professional services, restaurant) and 33 residential units; associated residential parking for occupiers of the development, cycle storage, amenity space and refuse storage.",,170-176,Grange Road,SE1 3BN,GRANGE,08/02/2010,03/08/2012,33,10,0
09-AP-1031,Full,"To change Clauses 1.1 and 4.1 of Legal Agreement ref. 126467 pursuant to planning permission ref. 08AP0309, which permitted (demolition of the existing buildings plus basement fronting Trinity Street providing 22 self contained flats, (2 x one bed, 17 x two bed, 3 x three bed) and 10 three storey plus basement four bedroom dwellinghouses with integral garages) from the provision of 36% of the housing to be affordable, to the provision of 26% of the housing to be affordable (by habitable room). The scheme would reduce the number of intermediate units by 4, as the affordable provision would be reduced to 10 social rented units ( 7 x 2 bed and 3 x 3 bed).",,28 - 30,Trinity Street,SE1 4JE,CHAUCER,28/07/2009,30/04/2012,32,10,
09-AP-1049,Full,"Currently approved 10 unit residential scheme with commercial unit - shop/retail and cafe (A1, A3) on ground level and basement ( LBS reg: 05-AP-0099) to be revised to: Introduce B1 (office) use and A2 (financial and professional services) to the ground floor and exclude basement level",,"Manor Tavern P.H.,   78",Galleywall Road,SE16 3PB,SOUTH BERMONDSEY,25/03/2010,31/10/2011,10,10,0
09-AP-1769,Full,"Demolition of all buildings on site, coach depot and garages. Retention of boundary wall to rear garden properties along Hollydale Road and Brabourn Grove and redevelopment to provide a total of 22 units incorporating a four storey residential block fronting Evelina Road comprising 10 self contained units (8x2 bedroom and 2x3 bedroom) and a row of 12, 3 storeys terraced houses (9x3 bedroom and 3x4 bedroom) including 18 car spaces and associated cycle parking.",,Rear Of175-205,Hollydale Road,SE15 2BS,NUNHEAD,25/11/2009,01/04/2013,22,10,0
05-AP-2564,Full,"Demolish existing public house, erect 3 storey building for 9 x two-bedroom flats with  associated landscaping and 6 parking spaces (RE-SUBMISSION).",,"Sir Ernest Shackleton P.H.,  122",Bowen Drive,SE21,COLLEGE,22/03/2006,20/06/2008,9,9,
05-AP-2669,Full,Alteration during course of construction of scheme approved 6/12/04 for construction of 28 flats and commercial to now: include the construction of 2 additional flats with offices (Class B1 Business Use) at ground and lower floors; including vehicular access to parking bays off Gibbons Rent.,,17-24,Magdalen Street,SE1 2EN,RIVERSIDE,08/11/2006,31/05/2008,30,9,
06-AP-1236,Full,"Amendments to the previously approved scheme ref: 03-AP-2314 (and legal agreement thereto) for the development of vacant land at 2-30 St James' Road to provide two buildings (each part-4/part-6) fronting St James' Road for 1 day nursery, 49 no flats for residential accommodation including affordable housing, 1 no administration office and basement for part residential, plant and storage.",Bermondsey Spa,"Bermondsey Spa Site J,  2-30",St James's Road,SE1,RIVERSIDE,28/09/2006,30/09/2008,49,9,
06-AP-1829,Full,"Erection of 2/3 storey building of nine residential units (1 bedroom) for residents with physical and sensory disabilities, including 2 disabled parking bays, 10 cycle storage spaces, a communal conservatory and gardens.",,1,Priter Road,SE16 4QW,RIVERSIDE,05/02/2007,30/04/2009,9,9,
07-AP-1124,Full,Demolition of  building and erection of an eight storey building plus basement comprising 40 flats and 762m² of commercial floorspace (A1/A2/A3/B1).,,44 - 46,Borough Road,SE1 0AJ,CATHEDRALS,15/08/2007,31/03/2011,40,9,
09-AP-1874,Full,"Erection of a part 4/part 7 storey development to provide 409sqm B1 space at ground floor with residential on upper floors comprising of 33 dwellings (6x1 bed, 16x2 bed and 11x3 bed) and 7 car parking spaces at ground floor and associated cycle store, energy store and refuse storag",,150,Spa Road,SE16 4RR,RIVERSIDE,24/11/2009,31/03/2012,33,9,0
10-AP-2429,Full,"Erection of 9 residential dwellings, 3 storeys in height (8x 4 bed and 1x 5 bed) at the former car park site on Alice Street; provision of vehicular access from Alice Street, 2 car parking spaces and storage for a total of 27 cycles; as well as hard and soft landscaping.",,Former Car Park,Alice Street,SE1 4QZ,CHAUCER,15/10/2010,31/03/2013,9,9,0
11-AP-2242,Full,"Demolition of existing buildings, and erection of 28 residential dwellings (6x1 bed; 13x2 bed; 9x3 bed) within a part three, part four storey building at the southern end of the site with associated car parking, cycle storage and amenity spaces. Erection of a new single storey community building (maximum height approximately 7 metres above ground) on the northern part of the site, accessed from Salter Road, providing general hall, meeting spaces and sports facilities, and a new flood-lit external sports pitch",,,Rotherhithe Street,SE16 5LJ,SURREY DOCKS,15/03/2012,08/02/2015,28,9,0
11-AP-2851,Full,"Redevelopment of the site involving the demolition of existing pre-fab bungalows and their replacement with a two storey terrace of 14 residential units (5 x 4 bed, 7 x 3 bed, and 2 x 1 bed units) with rear dormer windows and photovoltaic panels.",,Land Between 120-150,Ivydale Rd,SE15 3BT,NUNHEAD,01/12/2011,11/02/2014,14,9,
12-AP-1308,Full,"Demolition of existing buildings on site and redevelopment to provide mixed use premises with a maximum height of 6 storeys with set backs at 1st and 6th floors, providing 101 residential units (2 x studio units, 30 x 1 bed, 46 x 2 bed, 23 x 3 bed) and 1,335sqm of commercial uses within use Classes A1, A2, A3 and B1 at ground floor. Associated areas for cycle storage, disabled parking bays (4 spaces) and amenity space.",,1-6 And 307-311,Camberwell New Green,SE5,CAMBERWELL GREEN,08/10/2013,03/03/2017,101,9,"736,350"
12-AP-4049,Full,"Erection of a building fronting Blue Anchor Lane of between 4 and 7 storeys in height, to provide 37 residential units (1 x studio, 9 x 1 bed, 19 x 2 bed, 7 x 3 bed). Erection of 1 x 3 bed mews house fronting Bombay Street. Provision of eight car parking and 76 cycle parking spaces accessed from Bombay Street, provision of communal and private amenity space, and doorstep play space",,27-29,Blue Anchor Lane,SE16 3UL,SOUTH BERMONDSEY,19/04/2013,09/04/2016,37,9,
13-AP-2211,Full,"Alterations to the ground floor and part of the first floor of the Camberwell Station Road block (previously permitted as B1 office use) for it to be used as nine self-contained affordable rented units, alterations to existing windows and erection of balconies at first floor level to rear elevation and amendments to an existing s106 agreement pursuant to planning permission reference: 06-AP-2183",,,And At 69-91 Camberwell Station Road And 90-106 Warner Road,SE5,CAMBERWELL GREEN,09/04/2014,16/03/2016,9,9,
14-AP-0115,Full,"DEMOLITION OF THE EXISTING BUILDING AND ERECTION OF A PART 3, PART 4, STOREY BUILDING COMPRISING 22 RESIDENTIAL UNITS TOGETHER WITH BASEMENT CAR PARKING, LANDSCAPING AND WORKS INCIDENTAL TO THE DEVELOPMENT",,2-2a,Crystal Palace Road,SE22 9HB,EAST DULWICH,13/02/2015,03/03/2019,22,9,
03-AP-1799,Full,Convert church interior to 31 flats over 5 floors including crypt.,,Saint Augustine's Church,Lynton Road,SE1 5DP,SOUTH BERMONDSEY,18/03/2005,31/07/2007,31,8,
05-AP-1560,Full,"External alterations, refurbishment of existing for 8x s/contained flats, improvements to existing office accommodation & shared facilities.  Retention of supported housing use (re: mental health), daily on site suport 9.00-9.00 + out of hours service (replaces 10 place hostel).",,212,Peckham Rye,SE22 0LU,PECKHAM RYE,01/12/2005,31/03/2008,8,8,
07-AP-2553,Full,Demolition of vicarage and associated buildings; erection of new parsonage and a four storey block comprising 8 flats (2 x 1 bed and 6 x 2 beds) with assoc works,,2 [Ex Vicarage],Thurland Road,SE16 4AA,RIVERSIDE,13/02/2009,31/03/2012,8,8,
08-AP-0726,Full,Demolition of former Bricklayers Arms PH and the erection of four storey building comprising 8 flats with associated amenity space to the rear and landscaping.,,121-123,Southampton Way,SE5 7EW,BRUNSWICK PARK,05/06/2009,01/07/2012,8,8,0
